[
  {
    "slug": "rajas",
    "glyph": "🜍",
    "guna": "Rajas",
    "color": "Yellow",
    "element": "Air",
    "alchemy": "Sulfur",
    "consciousness": "Superconscious",
    "principle": "Desire & Activity"
  },
  {
    "slug": "sattva",
    "glyph": "☿",
    "guna": "Sattva",
    "color": "Red",
    "element": "Fire",
    "alchemy": "Mercury",
    "consciousness": "Self-conscious",
    "principle": "Wisdom & Light"
  },
  {
    "slug": "tamas",
    "glyph": "🜔",
    "guna": "Tamas",
    "color": "Blue",
    "element": "Water",
    "alchemy": "Salt",
    "consciousness": "Subconscious",
    "principle": "Ignorance & Inertia"
  }
]
